{
  "id": "EMS-STATION-001",
  "title": "按名称搜索电站",
  "requirement": "REQ-EMS-201",
  "priority": "P1",
  "sources": ["REQ-EMS-201"],
  "fixtures": ["station_page", "report_page"],
  "pages": { "station_page": "StationPage", "report_page": "ReportPage" },
  "steps": [
    { "action": "call", "page": "station_page", "method": "open" },
    { "action": "call", "page": "station_page", "method": "search_by_keyword", "args": { "keyword": "华东" } },
    { "action": "expect", "page": "station_page", "method": "result_count", "matcher": "gt", "value": 0 },
    { "action": "call", "page": "report_page", "method": "export_as_pdf" }
  ]
}
