{
  "id": "TH-005",
  "title": "页脚备案信息与语言切换入口存在",
  "requirement": "TH-FOOTER",
  "priority": "P2",
  "tags": ["footer"],
  "risk": "合规备案信息缺失，或语言切换入口丢失",
  "steps": [
    { "action": "goto", "url": "/" },
    { "action": "expect", "target": { "text": "渝ICP备2022001292号" }, "assertion": { "type": "visible" } },
    { "action": "expect", "target": { "role": "link", "name": "简体中文", "exact": true }, "assertion": { "type": "visible" } },
    { "action": "expect", "target": { "role": "link", "name": "Github", "exact": true }, "assertion": { "type": "visible" } }
  ]
}
